question,answer,category


What is aspirin used for?,Aspirin is used for pain relief and reducing fever.,usage
How does aspirin work?,Aspirin inhibits COX enzymes and reduces prostaglandin production.,mechanism
What are side effects of aspirin?,Possible side effects include stomach irritation and bleeding.,safety
What is metformin used for?,Metformin is used to control blood glucose in type 2 diabetes.,usage
How does metformin work?,Metformin reduces glucose production in the liver and improves insulin sensitivity.,mechanism

